{
  "schemaVersion": 1,
  "schema": "crops",
  "notes": "Phobos Agriculture crops (Agriculture 0.40.0): what a Firstlight rack grows, what each planting needs and what a harvest gives. One entry per crop; the entry's name is what a saved planting stores, so a published crop is frozen (frozen-crops.json): change one by adding a crop beside it. Every crop conserves mass: water + nutrient + 0.4 x carbon - vapour = final - seed, where 0.4 x carbon is the carbon dioxide taken in less the oxygen given off (CH2O, 30 g per mol of carbon). Growth times are authored gameplay balance, far shorter than real cultivation; see docs/development/agriculture-research.md for the NASA and ESA sources and their limits. The items section names the crop items the code builds from the materials pack, their text and what eating one gives.",
  "crops": {
    "potato": {
      "notes": "Seed potato into a five-kilogram cohort over 96 hours at 0.75 kW. A harvest keeps one seed potato and gives 0.4 kg raw portions for the Hearth-2. Unchanged since Agriculture 0.2.0.",
      "hours": 96,
      "kw": 0.75,
      "seedKg": 0.2,
      "finalKg": 5,
      "carbonKg": 0.84,
      "nutrientKg": 0.04,
      "waterKg": 4.624,
      "vapourKg": 0.2,
      "seedCarbonKg": 0.04,
      "edibleKg": 4.2,
      "keptStockKg": 0.2,
      "portionKg": 0.4,
      "stock": "PhobosVerdemorrowContinuancePotato",
      "produce": "PhobosVerdemorrowRawPotatoes",
      "feed": "potato-v1",
      "feedCommodity": "potato feed",
      "art": "Potato"
    },
    "lettuce": {
      "notes": "One seed packet into 1.2 kg of lettuce over 48 hours at 0.4 kW, cut as 0.25 kg portions eaten as they are. Unchanged since Agriculture 0.2.0.",
      "hours": 48,
      "kw": 0.4,
      "seedKg": 0.005,
      "finalKg": 1.2,
      "carbonKg": 0.0605,
      "nutrientKg": 0.005,
      "waterKg": 1.2658,
      "vapourKg": 0.1,
      "seedCarbonKg": 0.0045,
      "edibleKg": 1,
      "keptStockKg": 0,
      "portionKg": 0.25,
      "stock": "PhobosVerdemorrowContinuanceLettuce",
      "produce": "PhobosVerdemorrowLettuce",
      "feed": "lettuce-v1",
      "feedCommodity": "lettuce feed",
      "art": "Lettuce"
    },
    "lettuce-seed": {
      "notes": "Lettuce left to bolt for seed: one packet into four packets over 96 hours. An authored seed cycle, separate from the food crop.",
      "hours": 96,
      "kw": 0.4,
      "seedKg": 0.005,
      "finalKg": 1.2,
      "carbonKg": 0.0725,
      "nutrientKg": 0.01,
      "waterKg": 1.356,
      "vapourKg": 0.2,
      "seedCarbonKg": 0.0045,
      "edibleKg": 0.02,
      "keptStockKg": 0,
      "portionKg": 0.005,
      "stock": "PhobosVerdemorrowContinuanceLettuce",
      "produce": "PhobosVerdemorrowContinuanceLettuce",
      "feed": "lettuce-seed-v1",
      "feedCommodity": "lettuce seed feed",
      "art": "LettuceSeed"
    },
    "wheat": {
      "notes": "Dwarf wheat (Agriculture 0.41.0): one 50 g packet of seed wheat into a 1.4 kg cohort over 84 hours at 1.2 kW. A harvest keeps one packet back for the next planting and gives one 0.4 kg portion of grain; the rest, about 0.95 kg, is straw. Authored in the ratios NASA Kennedy Space Center's Biomass Production Chamber found against potato: a slightly shorter cycle (77 to 86 days against 90 to 105), the most light, about 30 to 40% of the plant edible, and a ripe crop that is mostly dry matter. See docs/development/agriculture-crop-expansion.md; the hours are authored gameplay balance.",
      "hours": 84,
      "kw": 1.2,
      "seedKg": 0.05,
      "finalKg": 1.4,
      "carbonKg": 1.1,
      "nutrientKg": 0.045,
      "waterKg": 1.165,
      "vapourKg": 0.3,
      "seedCarbonKg": 0.044,
      "edibleKg": 0.46,
      "keptStockKg": 0.05,
      "portionKg": 0.4,
      "stock": "PhobosVerdemorrowContinuanceWheat",
      "produce": "PhobosVerdemorrowWheatGrain",
      "feed": "wheat-v1",
      "feedCommodity": "wheat feed",
      "art": "Wheat"
    },
    "tomato": {
      "notes": "Dwarf tomato (Agriculture 0.42.0): one 5 g seed packet into a 5 kg plant, first ripe after 64 hours at 0.7 kW. A ripe plant can be picked three times, up to three 0.25 kg portions a pick; each pick sets growth back by the share of a cycle it took, so the plant regrows that fruit from the same budget (about ten hours at full health). The final harvest takes the rest, a seed packet kept from the fruit and the vine as residue. Ratios after NASA Kennedy Space Center's Biomass Production Chamber tomato: first fruit at about two thirds of potato's cycle, fruit picked as it ripened over the last quarter, about half the dry matter in fruit, and ripe fruit 94.5% water (USDA). See docs/development/agriculture-crop-expansion.md; hours, picks and yields are authored gameplay balance.",
      "hours": 64,
      "kw": 0.7,
      "seedKg": 0.005,
      "finalKg": 5,
      "carbonKg": 0.52,
      "nutrientKg": 0.025,
      "waterKg": 4.962,
      "vapourKg": 0.2,
      "seedCarbonKg": 0.0045,
      "edibleKg": 3.6,
      "keptStockKg": 0.005,
      "portionKg": 0.25,
      "picks": 3,
      "pickKg": 0.75,
      "stock": "PhobosVerdemorrowContinuanceTomato",
      "produce": "PhobosVerdemorrowTomatoes",
      "feed": "tomato-v1",
      "feedCommodity": "tomato feed",
      "art": "Tomato"
    },
    "soybean": {
      "notes": "Soybean (Agriculture 0.42.0): one 30 g seed packet into a 0.9 kg stand over 90 hours at 0.65 kW. A harvest keeps one packet back and gives one 0.25 kg portion of dry beans; the rest, about 0.62 kg, is straw. Ratios after NASA Kennedy Space Center's Biomass Production Chamber soybean: about potato's cycle (90 to 97 days), less light than wheat, about a third of the dry matter in seed, and seed of 37% protein and 20% fat (dry basis). See docs/development/agriculture-crop-expansion.md; hours and yields are authored gameplay balance.",
      "hours": 90,
      "kw": 0.65,
      "seedKg": 0.03,
      "finalKg": 0.9,
      "carbonKg": 0.68,
      "nutrientKg": 0.024,
      "waterKg": 0.774,
      "vapourKg": 0.2,
      "seedCarbonKg": 0.027,
      "edibleKg": 0.29,
      "keptStockKg": 0.03,
      "portionKg": 0.25,
      "stock": "PhobosVerdemorrowContinuanceSoybean",
      "produce": "PhobosVerdemorrowSoybeans",
      "feed": "soybean-v1",
      "feedCommodity": "soybean feed",
      "art": "Soybean"
    },
    "flax": {
      "notes": "Fibre flax (Agriculture 0.45.0): one 10 g packet of flax seed sown dense into a 1.6 kg stand over 90 hours at 0.9 kW. Pulled at yellow ripeness and retted, a harvest gives four 0.25 kg bundles of flax straw for the B2 to scutch into the game's clean scrap cloth, keeps one packet of linseed back for the next sowing, and leaves about 0.59 kg of roots, leaves and bolls as residue. Fibre flax takes about 90 to 100 days from sowing to pulling; the hours, light and yields are authored gameplay balance. See docs/development/agriculture-crop-expansion.md.",
      "hours": 90,
      "kw": 0.9,
      "seedKg": 0.01,
      "finalKg": 1.6,
      "carbonKg": 1.2,
      "nutrientKg": 0.035,
      "waterKg": 1.375,
      "vapourKg": 0.3,
      "seedCarbonKg": 0.009,
      "edibleKg": 1.05,
      "keptStockKg": 0.01,
      "portionKg": 0.25,
      "stock": "PhobosVerdemorrowContinuanceFlax",
      "produce": "PhobosVerdemorrowFlaxStraw",
      "feed": "flax-v1",
      "feedCommodity": "flax feed",
      "art": "Flax"
    }
  },
  "co2Response": {
    "notes": "How the rack's room carbon dioxide speeds growth (Agriculture 0.43.0): points of (CO2 partial pressure in kPa, growth factor). The factor multiplies growth per hour and per kWh; budgets per kilogram are unchanged, so an enriched room shortens the cycle and its energy. At a normal cabin pressure 0.1 kPa is about 1,000 ppm. Source findings: NASA Kennedy Space Center ran its Biomass Production Chamber at 1,000 or 1,200 ppm and found C3 crop photosynthesis saturating between about 1,000 and 1,500 ppm (NASA/TM-2003-211184); Utah State University found wheat seed yield 13 to 40% higher at 1,000 to 1,200 ppm than at ambient, falling 15 to 22% at 2,500 ppm and 37% by 10,000 ppm (Grotenhuis and Bugbee 1997; Reuveni and Bugbee 1997; Bugbee and colleagues 1994). Authored: +20% at 0.1 kPa and +25% at 0.15 kPa, back to the historic rate by 0.5 kPa and slower above; no penalty below 0.04 kPa (a room with no CO2 still stops growth, as before). Every shipped crop is a C3 plant and shares the curve.",
    "points": [ [0.04, 1], [0.1, 1.2], [0.15, 1.25], [0.25, 1.05], [0.5, 1], [1, 0.85] ]
  },
  "items": {
    "PhobosVerdemorrowContinuancePotato": { "text": "potato_seed" },
    "PhobosVerdemorrowContinuanceLettuce": { "text": "lettuce_seed" },
    "PhobosVerdemorrowRawPotatoes": { "text": "raw" },
    "PhobosVerdemorrowHearthPotatoes": { "text": "meal", "hunger": 5, "satiety": 3 },
    "PhobosVerdemorrowLettuce": { "text": "leaves", "hunger": 1, "satiety": 1 },
    "PhobosVerdemorrowContinuanceWheat": { "text": "wheat_seed" },
    "PhobosVerdemorrowWheatGrain": { "text": "wheat_grain" },
    "PhobosVerdemorrowContinuanceTomato": { "text": "tomato_seed" },
    "PhobosVerdemorrowTomatoes": { "notes": "Eaten fresh, like lettuce: a quarter kilogram of tomatoes is little food energy.", "text": "tomatoes", "hunger": 1, "satiety": 1 },
    "PhobosVerdemorrowContinuanceSoybean": { "text": "soybean_seed" },
    "PhobosVerdemorrowSoybeans": { "text": "soybeans" },
    "PhobosVerdemorrowHearthSoybeans": { "notes": "A bowl from 0.25 kg of dry beans: about three potato portions of food energy and far more protein, so it satisfies for longer.", "text": "soybean_stew", "hunger": 8, "satiety": 6 },
    "PhobosVerdemorrowContinuanceFlax": { "text": "flax_seed" },
    "PhobosVerdemorrowFlaxStraw": { "notes": "Not food: retted flax straw for the B2 to scutch.", "text": "flax_straw" },